{
  "$schema": "https://json-schema.org/draft/2020-12/schema",
  "$id": "https://dozikur.github.io/dnb-briefing/schemas/briefing.schema.json",
  "title": "DnB & Festival Intelligence Briefing",
  "type": "object",
  "additionalProperties": false,
  "required": ["schema_version", "period", "headline", "executive_summary", "sections", "sources_scanned"],
  "properties": {
    "schema_version": { "const": 2 },
    "period": {
      "type": "object",
      "additionalProperties": false,
      "required": ["year", "week", "window_start", "window_end", "generated_at"],
      "properties": {
        "year": { "type": "integer", "minimum": 2026 },
        "week": { "type": "integer", "minimum": 1, "maximum": 53 },
        "window_start": { "type": "string", "format": "date" },
        "window_end": { "type": "string", "format": "date" },
        "generated_at": { "type": "string", "format": "date-time" }
      }
    },
    "headline": { "type": "string", "minLength": 8, "maxLength": 160 },
    "executive_summary": {
      "type": "array",
      "minItems": 1,
      "maxItems": 5,
      "items": { "type": "string", "minLength": 20, "maxLength": 360 }
    },
    "sections": {
      "type": "array",
      "minItems": 7,
      "maxItems": 7,
      "items": { "$ref": "#/$defs/section" }
    },
    "sources_scanned": {
      "type": "array",
      "minItems": 1,
      "items": { "type": "string", "minLength": 2, "maxLength": 120 },
      "uniqueItems": true
    }
  },
  "$defs": {
    "section": {
      "type": "object",
      "additionalProperties": false,
      "required": ["id", "title", "items"],
      "properties": {
        "id": { "enum": ["competition", "festival_industry", "dnb_scene", "cz_sk", "audience_sentiment", "strategic_releases", "lir_actions"] },
        "title": { "type": "string", "minLength": 2, "maxLength": 80 },
        "items": { "type": "array", "maxItems": 6, "items": { "$ref": "#/$defs/item" } }
      }
    },
    "item": {
      "type": "object",
      "additionalProperties": false,
      "required": ["id", "published_at", "event_start", "event_end", "title", "summary", "why_it_matters", "recommended_action", "region", "category", "competitors", "confidence", "sources", "media", "tags"],
      "properties": {
        "id": { "type": "string", "pattern": "^[a-z0-9][a-z0-9-]{7,100}$" },
        "published_at": { "type": "string", "format": "date" },
        "event_start": { "type": ["string", "null"], "format": "date" },
        "event_end": { "type": ["string", "null"], "format": "date" },
        "title": { "type": "string", "minLength": 8, "maxLength": 180 },
        "summary": { "type": "array", "minItems": 1, "maxItems": 4, "items": { "type": "string", "minLength": 20, "maxLength": 520 } },
        "why_it_matters": { "type": "string", "minLength": 20, "maxLength": 520 },
        "recommended_action": { "type": "string", "minLength": 10, "maxLength": 300 },
        "region": { "enum": ["world", "europe", "cz_sk", "global"] },
        "category": { "enum": ["competition", "festival_industry", "dnb_scene", "cz_sk", "audience_sentiment", "strategic_release", "lir_action"] },
        "competitors": { "type": "array", "items": { "type": "string", "minLength": 2, "maxLength": 80 }, "uniqueItems": true },
        "confidence": { "enum": ["confirmed", "probable", "unverified"] },
        "sources": { "type": "array", "minItems": 1, "maxItems": 5, "items": { "$ref": "#/$defs/source" } },
        "media": { "type": "array", "maxItems": 3, "items": { "$ref": "#/$defs/media" } },
        "tags": { "type": "array", "maxItems": 8, "items": { "type": "string", "minLength": 2, "maxLength": 40 }, "uniqueItems": true }
      }
    },
    "source": {
      "type": "object",
      "additionalProperties": false,
      "required": ["name", "url", "kind"],
      "properties": {
        "name": { "type": "string", "minLength": 2, "maxLength": 100 },
        "url": { "type": "string", "format": "uri", "pattern": "^https://" },
        "kind": { "enum": ["primary", "secondary", "community"] }
      }
    },
    "media": {
      "type": "object",
      "additionalProperties": false,
      "required": ["type", "url"],
      "properties": {
        "type": { "enum": ["image", "instagram", "youtube", "spotify", "soundcloud"] },
        "url": { "type": "string", "format": "uri", "pattern": "^https://" }
      }
    }
  }
}
