{
  "schema_version": 2,
  "period": {
    "year": 2026,
    "week": 29,
    "window_start": "2026-07-13",
    "window_end": "2026-07-19",
    "generated_at": "2026-07-20T12:35:00+02:00"
  },
  "headline": "Chase & Status debutovali na Tomorrowlandu a příští víkend zamíří na Mainstage",
  "executive_summary": [
    "Chase & Status odehráli svůj první set na Tomorrowlandu a 26. července se na festival vrátí s debutem na Mainstage.",
    "Liquicity Festival vydal poslední varování před vyprodáním poté, co počet zbývajících víkendových vstupenek klesl pod sto.",
    "Tomorrowland nesměl během prvního víkendu použít ohňostroje ani pódiovou pyrotechniku kvůli zvýšenému požárnímu riziku.",
    "Pohoda po vyprodaném jubilejním ročníku prodala během pěti dnů přes deset tisíc vstupenek na rok 2027.",
    "Hedex oznámil nový koncertní koncept Nu Era Laser + Stage Show s premiérou na festivalu MHITR."
  ],
  "sections": [
    {
      "id": "competition",
      "title": "Přímá konkurence",
      "items": [
        {
          "id": "liquicity-final-sellout-warning-2026",
          "published_at": "2026-07-17",
          "event_start": null,
          "event_end": null,
          "title": "Liquicity vydal poslední varování před vyprodáním",
          "summary": [
            "Liquicity Festival oznámil, že zbývá méně než sto víkendových vstupenek. Sobotní vstupenky a čtvrteční vstup do kempu byly podle pořadatelů téměř vyprodané.",
            "Organizátoři příspěvek označili za poslední varování před vyprodáním. Zpráva ukazuje silný závěr předprodeje u přímého evropského konkurenta v týdnu před konáním festivalu."
          ],
          "why_it_matters": "Tempo doprodeje víkendových, jednodenních a kempových kategorií nabízí aktuální srovnání pro prodejní vývoj evropského DnB festivalu.",
          "recommended_action": "Bez akce, pouze informační přehled",
          "region": "europe",
          "category": "competition",
          "competitors": ["Liquicity Festival"],
          "confidence": "confirmed",
          "sources": [{"name": "Liquicity Festival", "url": "https://www.instagram.com/p/Da5fKfDDK-V/?img_index=5", "kind": "primary"}],
          "media": [
            {"type": "image", "url": "https://imgproxy.ra.co/_/quality:66/aHR0cHM6Ly9pbWFnZXMucmEuY28vNTNlY2NhODMxYmZiMDQ5M2M1MTY0ZmE1OGM2MmI0MGVmMTdiMjIwZi5qcGc="},
            {"type": "instagram", "url": "https://www.instagram.com/p/Da5fKfDDK-V/"}
          ],
          "tags": ["Liquicity", "ticket sales", "sellout", "camping"]
        }
      ]
    },
    {
      "id": "festival_industry",
      "title": "Festivalový průmysl",
      "items": [
        {
          "id": "tomorrowland-pyrotechnics-ban-weekend-one",
          "published_at": "2026-07-15",
          "event_start": "2026-07-17",
          "event_end": "2026-07-19",
          "title": "Tomorrowland nesmí během prvního víkendu použít pyrotechniku",
          "summary": [
            "Tomorrowland 2026 nesměl během prvního festivalového víkendu použít ohňostroje ani pódiovou pyrotechniku. Starostové měst Boom a Rumst spolu s guvernérkou provincie rozhodli na doporučení hasičů po období extrémně vysokých teplot.",
            "Areál De Schorre i kemp Dreamville se nacházely v oblasti s druhým nejvyšším stupněm požárního rizika Code Orange. O případném použití pyrotechniky během druhého víkendu se mělo rozhodnout podle dalšího vývoje.",
            "Náhradu pomocí světelných dronů organizátoři vyloučili kvůli blízkému letišti. Festival uvedl, že se o původním rozhodnutí dozvěděl z médií; zástupci úřadů tento popis odmítli."
          ],
          "why_it_matters": "Případ ukazuje, že požární riziko může krátce před akcí změnit hlavní produkční prvky a že náhradní technologie nemusí být kvůli místním omezením dostupné.",
          "recommended_action": "Bez akce, pouze informační přehled",
          "region": "europe",
          "category": "festival_industry",
          "competitors": [],
          "confidence": "probable",
          "sources": [{"name": "DJ Mag", "url": "https://djmag.com/news/tomorrowland-2026-fireworks-and-pyrotechnics-banned-weekend-one-due-fire-risk", "kind": "secondary"}],
          "media": [{"type": "image", "url": "https://djmag.com/sites/default/files/styles/djm_23_961x540/public/2026-07/Screenshot%202026-07-15%20at%2013.12.07.png.webp?itok=FZiZhVb4"}],
          "tags": ["Tomorrowland", "pyrotechnics", "fire risk", "weather", "safety"]
        },
        {
          "id": "pohoda-record-presale-2027",
          "published_at": "2026-07-15",
          "event_start": "2027-07-08",
          "event_end": "2027-07-10",
          "title": "Pohoda po jubilejním ročníku hlásí rekordní předprodej",
          "summary": [
            "Jubilejní 30. ročník Pohody navštívilo 33 tisíc platících návštěvníků. Festival nejprve vyprodal původní kapacitu třicet tisíc lidí a následně také dodatečně uvolněné vstupenky po desetiprocentním navýšení kapacity.",
            "Od středy do nedělního poledne se prodalo více než deset tisíc vstupenek na Pohodu 2027, což pořadatelé označili za nejúspěšnější zahájení předprodeje ve své historii.",
            "Další ročník se uskuteční od 8. do 10. července 2027 na trenčínském letišti."
          ],
          "why_it_matters": "Výsledek ukazuje, jak může vyprodaný jubilejní ročník a prodej přímo v areálu urychlit předprodej dalšího roku.",
          "recommended_action": "Bez akce, pouze informační přehled",
          "region": "cz_sk",
          "category": "festival_industry",
          "competitors": [],
          "confidence": "confirmed",
          "sources": [{"name": "Pohoda Festival", "url": "https://www.instagram.com/p/Dazxsh7IEe0/", "kind": "primary"}],
          "media": [
            {"type": "image", "url": "https://encrypted-tbn0.gstatic.com/images?q=tbn:ANd9GcTUfNP2yYieWQPsxaOBRfamcJM-o9qtpFfoZHHnOo2tXB80QB9Q8ftpmoMN&s=10"},
            {"type": "instagram", "url": "https://www.instagram.com/p/Dazxsh7IEe0/"}
          ],
          "tags": ["Pohoda", "presale", "sellout", "capacity", "Slovakia"]
        }
      ]
    },
    {
      "id": "dnb_scene",
      "title": "DnB scéna",
      "items": [
        {
          "id": "chase-status-tomorrowland-debut-2026",
          "published_at": "2026-07-20",
          "event_start": "2026-07-19",
          "event_end": null,
          "title": "Chase & Status debutovali na Tomorrowlandu",
          "summary": [
            "Chase & Status odehráli během prvního víkendu Tomorrowlandu 2026 DJ set na Freedom stage. Oficiální program je zařadil na neděli 19. července od 20:00 a zveřejněné záběry zachycují silné reakce publika během jejich drum & bassového setu.",
            "Instagramový příspěvek označuje vystoupení za premiéru dua na Tomorrowlandu a vyzdvihuje množství nevydaných skladeb a neobvyklých mixů. Hodnocení setu jako jednoho z nejlepších vystoupení dvojice je názorem autora příspěvku, nikoli ověřeným faktem.",
            "Chase & Status se na festival vrátí v neděli 26. července s DJ setem na Mainstage. Tomorrowland je řadí mezi interprety, kteří tam letos absolvují svůj debut, takže během jednoho ročníku vystoupí na Freedom stage i hlavním pódiu."
          ],
          "why_it_matters": "Dvě vystoupení během jednoho ročníku ukazují výrazný posun drum & bassu do hlavního programu jednoho z největších světových elektronických festivalů.",
          "recommended_action": "Bez akce, pouze informační přehled",
          "region": "europe",
          "category": "dnb_scene",
          "competitors": [],
          "confidence": "confirmed",
          "sources": [
            {"name": "Instagram", "url": "https://www.instagram.com/p/DbAszJlk4Rg/?img_index=1", "kind": "community"},
            {"name": "Tomorrowland", "url": "https://tomorrowlandbelgium.press.tomorrowland.com/tomorrowland-unveils-the-full-line-up-and-timetable-for-consciencia-in-belgium", "kind": "primary"}
          ],
          "media": [
            {"type": "image", "url": "https://encrypted-tbn0.gstatic.com/images?q=tbn:ANd9GcSFhAOfXq5mXt9gxwU290vzmQU3ox-xBWUzXsJxYsHa7Roc_kgqMZIyv36T&s=10"},
            {"type": "instagram", "url": "https://www.instagram.com/p/DbAszJlk4Rg/"}
          ],
          "tags": ["Chase & Status", "Tomorrowland", "Freedom stage", "Mainstage", "DnB crossover"]
        },
        {
          "id": "hedex-nu-era-laser-stage-show",
          "published_at": "2026-07-15",
          "event_start": null,
          "event_end": null,
          "title": "Hedex představil Nu Era Laser + Stage Show",
          "summary": [
            "Hedex oznámil nový koncertní koncept Nu Era Laser + Stage Show. Projekt popsal jako další výrazný krok po svém vystoupení ve Wembley.",
            "Exkluzivní premiéra má proběhnout na festivalu MHITR následující pátek. Podrobnosti o podobě produkce zatím nezveřejnil, současně ale uvedl, že vstupenky na festival se blíží vyprodání."
          ],
          "why_it_matters": "Nový show formát posouvá Hedexe od běžného DJ setu k vlastní značkové produkci a může ovlivnit jeho budoucí festivalové požadavky i pozici v lineupech.",
          "recommended_action": "Bez akce, pouze informační přehled",
          "region": "europe",
          "category": "dnb_scene",
          "competitors": [],
          "confidence": "confirmed",
          "sources": [{"name": "Hedex", "url": "https://www.instagram.com/p/Daz6VdxqRcE/", "kind": "primary"}],
          "media": [
            {"type": "image", "url": "https://encrypted-tbn0.gstatic.com/images?q=tbn:ANd9GcQb8KnnBLPBak1g9e7QJSWIJpjc_yaYf_LVlTb3C1REl1jKIN7gDrIBl74&s=10"},
            {"type": "instagram", "url": "https://www.instagram.com/p/Daz6VdxqRcE/"}
          ],
          "tags": ["Hedex", "live show", "lasers", "stage production", "MHITR"]
        },
        {
          "id": "unknown-face-keep-it-running-debut-lp",
          "published_at": "2026-07-13",
          "event_start": null,
          "event_end": null,